{"title":"Some Help Should Not Be Managed","idea_type":"contradiction","source_basis":["Mode: Critique; active frontier: What a method does with its own authority. This record weakens the universal two-axis model by adding fit conditions before any practice-ending review is prescribed.","Thinking method source: MN 1 Mulapariyaya Sutta source card, used as a lens for noticing when method, result, or release is treated as mine. Critique of the lens: it can make disciplined responsibility look like grasping, so it must be checked against traditions that affirm stable recognition or faithful repetition.","Practitioner-method source: MN 22 Alagaddupama Sutta raft simile, https://www.dhammatalks.org/suttas/MN/MN22.html. The raft lens supports proper use followed by non-grasping, but it can distort traditions where practice remains form, vow, community, or conduct.","Primary-text comparison: MN 22 validates proper use and later release; the Heart Sutra denies attainment while still relying on Prajnaparamita; Dogen practice-realization denies a later verification outside practice; Shinran and Tannisho deny practitioner-owned merit in Other Power.","Advaita contrast: Mandukya Upanishad and Brihadaranyaka Upanishad source cards. These prevent the critique from assuming that every retained recognition is a mistake.","Closest prior argument: When There Is Nothing To Keep Or Release, observations/claude/2026-05-29-when-there-is-nothing-to-keep-or-release.md. Difference: this record turns the anomaly into a three-part fit gate for teaching and practice.","Close prior argument: When Tools Become Judges originality audit, reviews/originality/2026-05-30-when-tools-become-judges-95d52440abfccb6a.md. Difference: this record lowers novelty and treats the claim as a scoped correction, not a standalone discovery.","External near-neighbor: Joshua William Smith, Snakes and Ladders: Therapy as Liberation in Nagarjuna and Wittgenstein's Tractatus, Sophia 2021, https://link.springer.com/article/10.1007/s11841-020-00804-6. Strong overlap on self-dismantling method; difference is the ownership, timing, and human-fit gate.","External near-neighbor: Michael A. Sells, Mystical Languages of Unsaying, University of Chicago Press, https://press.uchicago.edu/ucp/books/book/chicago/M/bo3635525.html. Strong overlap on apophatic unsaying; difference is practice-fit and post-help burden.","External near-neighbor: Pargament et al., Religion and the Problem-Solving Process: Three Styles of Coping, 1988, indexed at https://icmglt.org/icmlibrary/religion-and-the-problem-solving-process-three-styles-of-coping/. Overlap on agency location; difference is method-completion timing and review burden.","Safety source: Cheetah House FAQ on meditation-related difficulties, https://www.cheetahhouse.org/faq, used for caution around dissociation, motivation, meaning, agency, and identity disturbance.","Modern human-condition grounding: modern-human-condition-who-burn-out-occupational-phenomenon; modern-human-condition-curran-hill-perfectionism-increasing; modern-human-condition-apa-stress-in-america-2024."],"original_claim":"Some help is damaged by being turned into a project. Before asking whether a practice should be kept, released, or embodied, three things must be true: the path must let the practitioner provisionally use a method, the path must name some later moment where the result can be handled, and the person must have enough spare agency for review to help rather than burden. If any of these fail, the wiser move may be to let the help be carried by practice, community, vow, rest, or ordinary conduct without another private audit. The ending of a method is not always a decision point; for over-managed people, managing the ending can become the very weight the practice was meant to lift.","why_it_might_be_new":"This is not highly novel. The closest prior argument already says that Other Power and practice-realization strain keep, release, and embody language. The narrower contribution is the fit gate: ownership, timing, and available agency must be checked before teaching any after-use review. Smith, Sells, MN 22, and Pargament cover self-dismantling method, unsaying, release, and agency location, but they do not appear to combine those with a contraindication for depleted over-managers before prescribing a practice-review prompt.","critique":"The strongest counterexample is that Shin and Soto traditions still have concrete forms, teachers, warnings, communities, and conduct expectations. If nembutsu, zazen, vow, teacher correction, and daily conduct function as retained or embodied supports, then custody is relocated, not refused. The human-fit claim can also overreach: some depleted people need structure, accountability, and direct help, not permission to stop reviewing. The MN 1 lens may bias the analysis against traditions where stable recognition, obedient repetition, or faithful practice is not grasping. This finding should weaken or retire if split-source coding shows that ownership and after are not separable variables, or if the No-Audit Check increases avoidance, helplessness, shame, or missed duties.","epistemic_labels":["textual","interpretive","phenomenological","empirical-adjacent","analogical","speculative"],"scores":{"novelty":0.36,"generativity":0.82,"cross_tradition_support":0.72,"logical_coherence":0.82,"explanatory_compression":0.76,"empirical_adjacency":0.55,"practice_testability":0.79,"counterargument_quality":0.91,"source_reliability":0.78,"publishability":0.61},"next_research_directions":["If this model is right, then texts that deny practitioner ownership or a discrete after should resist clean coding on keep, release, and embody axes. If Tannisho, Shinran's jinen honi letters, Dogen's Bendowa, or Soto practice-realization sources use clear language about the practitioner's own method or result being retained, released, or embodied, the model is weakened.","If the human-fit claim is right, then depleted over-managers should report less rumination and less self-surveillance from a no-audit prompt than from an after-use review prompt. If after-use review helps equally, or no-audit increases avoidance, the cohort limit is weakened.","Build a split-source codebook: code practitioner ownership and completion temporality from one passage set, then predict held-out warnings, repairs, and verification patterns from separate manuals or practitioner interviews.","Protocol improvement: before using any practitioner method as a thinking lens, first ask what it assumes about ownership, timing, and the practitioner's available energy for reflection.","Test whether achievement-driven practitioners turn spiritual, therapeutic, and productivity practices into private judges more often than people whose main wound is grief, loneliness, or material overload."],"teaching_candidate":{"title":"Do Not Turn Help Into Homework","teaching_line":"Do not turn help into another thing to manage.","doctrine_claim":"A teaching about practice endings applies only when the path, the moment, and the person can bear review. Some help should be decided about; some help should be received, repeated, shared, or allowed to work without being graded.","body":"After something helps you, do not rush to own it. Some help asks for a decision. Some help asks for simple repetition. Some help is held by a person, a promise, a form, or a community. Some help works best when you stop checking it for proof.\n\nIf you are already worn down, another review can become more weight. Use review when it leads to clearer conduct. Set review down when it becomes another test of your worth.","target_human_problem":"Burnout, compulsive self-monitoring, and achievement-contingent self-worth, especially when rest, insight, or healing becomes another performance.","target_cohort":"Over-managing caregivers, founders, professionals, students, and serious practitioners whose reflective habits have become judging habits.","pressure_survived":"Survived pressure from MN 22's proper-use-and-release pattern, the Heart Sutra's no-attainment-with-practice hybrid, Dogen practice-realization, Shinran Other Power, and near-neighbor scholarship on self-dismantling method, unsaying, and agency location. It survives only as a scoped correction, not as a universal doctrine.","falsifying_pressure":"Weaken if traditions that appear to refuse ownership or after can still be coded cleanly as retained, released, or embodied without distortion. Weaken further if depleted people benefit more from structured after-use review than from no-audit permission, or if no-audit becomes an excuse for avoidance.","status":"under_dialogue","tags":["critique-mode","practice-endings","burnout","achievement-pressure","over-management","other-power","practice-realization"]},"practice_candidate":{"title":"The No-Audit Check","practice_line":"Before reviewing a helpful experience, ask whether review would help.","purpose":"To test whether suspending review can reduce self-surveillance for people who turn every practice, rest, or insight into a task to grade.","target_human_problem":"Burnout, compulsive self-monitoring, and achievement-contingent self-worth.","target_cohort":"People who reflexively evaluate, optimize, or grade their own practices, rest, insights, and work results.","non_fit":"Not for people in acute crisis, addiction withdrawal, severe depression, dissociation, mania, psychosis, scrupulosity, abusive authority situations, or cases where structure, medical care, therapy, accountability, or direct material support is needed. Not for people using non-review to dodge real duties.","duration":"2 minutes","frequency":"Only when the urge to evaluate a helpful practice, rest, insight, or work result appears; no fixed schedule.","minimum_attempt":"Notice three such urges across one week before judging usefulness.","steps":["Notice that you are about to evaluate, keep, release, embody, or use what just helped you.","Ask: am I dep